{
  "artefakt_id": "A08",
  "projekt_id": "MA-20261003-001",
  "version": "0.1.0",
  "datum": "2026-10-03",
  "autor": "[Verantwortliche Person eintragen.]",
  "status": "Entwurf",
  "eingaben": [],
  "quellen": [],
  "offene_punkte": [
    "Beispielvorlage vollständig bearbeiten; fehlende Nachweise sind keine Freigabe."
  ],
  "gesperrt": false,
  "sperrgrund": "",
  "beispiel": true,
  "inhalt": {
    "preview_pfad": "08_produktion/inbox/preview.mp4",
    "preview_sha256": "",
    "produktionsnotizen": [
      "Nur Zielpfad als Platzhalter; noch keine Previewdatei oder Produktion vorhanden."
    ]
  }
}
